{
  "schemaVersion": 1,
  "builtFrom": {
    "factsThrough": "2026-10-22",
    "readingsThrough": null
  },
  "threadId": "thread-a",
  "forks": [
    {
      "forkId": "PRED#A/2026-10-20",
      "drawnAt": "2026-10-20T05:00:00.000Z",
      "branches": [
        {
          "branchId": "a-0",
          "text": "text a-0",
          "p": 40,
          "trigger": "trigger a-0",
          "resolutionSource": "Reuters",
          "due": "2026-10-25",
          "verdict": null
        },
        {
          "branchId": "a-1",
          "text": "text a-1",
          "p": 40,
          "trigger": "trigger a-1",
          "resolutionSource": "Reuters",
          "due": "2026-10-21",
          "verdict": null
        },
        {
          "branchId": "a-2",
          "text": "text a-2",
          "p": 40,
          "trigger": "trigger a-2",
          "resolutionSource": "Reuters",
          "due": "2026-10-22",
          "verdict": {
            "at": "2026-10-22T06:00:00.000Z",
            "result": "yes",
            "decidedBy": "agent",
            "evidence": {
              "url": "https://e.test"
            },
            "voidReason": null
          }
        },
        {
          "branchId": "a-3",
          "text": "text a-3",
          "p": 40,
          "trigger": "trigger a-3",
          "resolutionSource": "Reuters",
          "due": "2026-10-20",
          "verdict": {
            "at": "2026-10-20T09:00:00.000Z",
            "result": "no",
            "decidedBy": "agent",
            "evidence": {
              "url": "https://e.test"
            },
            "voidReason": null
          }
        }
      ]
    }
  ]
}
